{
  "version": 1,
  "areas": [
    "GitHub and code review",
    "browser automation",
    "database inspection"
  ],
  "alwaysActive": [],
  "managed": [
    {
      "name": [
        "github_pr_get",
        "github_pr_threads",
        "github_pr_checks"
      ],
      "area": "GitHub and code review",
      "aliases": [
        "GitHub",
        "pull request",
        "PR",
        "review comments",
        "unresolved threads",
        "CI checks"
      ],
      "note": "Replace these sample names with exact names from /tool-audit"
    },
    {
      "path": "*/trusted-browser-extension/*",
      "area": "browser automation",
      "aliases": [
        "browser",
        "web page",
        "navigate",
        "click",
        "form",
        "screenshot"
      ],
      "note": "Replace this sample path with an exact audited path or a narrow wildcard"
    }
  ],
  "blocked": [],
  "aliases": [
    {
      "name": "get_threads",
      "terms": [
        "pull request review threads",
        "unresolved review comments"
      ]
    }
  ],
  "search": {
    "defaultLimit": 3,
    "maxLimit": 5,
    "minimumScore": 2,
    "showUnmanagedHints": true
  },
  "audit": {
    "largeSchemaTokens": 1000
  }
}
